{
  "$schema": "https://json-schema.org/draft/2020-12/schema",
  "$id": "https://relay.local/contracts/ai-result.schema.json",
  "title": "Relay AI Result Envelope",
  "type": "object",
  "additionalProperties": false,
  "required": [
    "jobId",
    "jobType",
    "schemaVersion",
    "projectId",
    "status",
    "completedAt"
  ],
  "properties": {
    "jobId": { "type": "string", "minLength": 1 },
    "jobType": {
      "type": "string",
      "enum": ["meeting.process", "meeting.reprocess", "meeting.transcribe", "command.interpret", "content.embed"]
    },
    "schemaVersion": { "const": 1 },
    "projectId": { "type": "string", "minLength": 1 },
    "resourceId": { "type": "string", "minLength": 1 },
    "correlationId": { "type": "string", "minLength": 1 },
    "status": { "type": "string", "enum": ["succeeded", "failed"] },
    "completedAt": { "type": "string", "format": "date-time" },
    "payload": { "type": "object" },
    "error": {
      "type": "object",
      "additionalProperties": false,
      "required": ["code", "message", "retryable"],
      "properties": {
        "code": { "type": "string", "minLength": 1 },
        "message": { "type": "string", "minLength": 1 },
        "retryable": { "type": "boolean" }
      }
    }
  },
  "allOf": [
    {
      "if": { "properties": { "status": { "const": "succeeded" } } },
      "then": { "required": ["payload"] },
      "else": { "required": ["error"] }
    }
  ]
}
